{
  "$schema": "https://raw.githubusercontent.com/Property-Data-Trust-Framework/schemas/master/src/schemas/pdtf-transaction.json",
  "transactionId": "3e4666bf-d5e5-4aa7-b8ce-cefe41c7568a",
  "status": "active",
  "participants": [
    {
      "name": {
        "firstName": "Peter",
        "lastName": "Hetherington-Smythe"
      },
      "dateOfBirth": "1975-12-25",
      "phone": "07777 222333",
      "email": "peter@theseller.com",
      "address": { "line1": "47 Park Road", "postcode": "AL3 5AF" },
      "role": "Seller"
    }
  ],
  "propertyPack": {
    "materialFacts": {
      "uprn": 1241304304,
      "address": {
        "line1": "47 Park Road",
        "line2": "",
        "town": "HARPENDEN",
        "county": "Herts",
        "postcode": "AL3 5AF"
      },

      "delayFactors": {
        "hasDelayFactors": { "yesNo": "No" }
      },
      "ownership": {
        "ownershipType": "Freehold"
      },
      "parking": {
        "parkingArrangements": {
          "parkingArrangementsType": "Other",
          "otherParkingType": "Garage and double width driveway"
        },
        "electricVehicleChargingPoint": { "yesNo": "No" }
      },
      "listingAndConservation": {
        "isListed": {
          "yesNo": "No"
        },
        "isConservationArea": {
          "yesNo": "No"
        },
        "hasTreePreservationOrder": {
          "yesNo": "No"
        }
      },
      "typeOfConstruction": {
        "isStandardForm": {
          "yesNo": "Yes"
        },
        "hasFlammableExternalWallSystem": "No"
      },
      "energyEfficiency": {
        "energyEfficiencyRating": "A",
        "hasSprayFoamInstalled": {
          "yesNo": "No"
        }
      },
      "councilTax": {
        "councilTaxBand": "A",
        "councilTaxAffectingAlterations": {
          "yesNo": "No"
        }
      },
      "disputesAndComplaints": {
        "hasDisputesAndComplaints": {
          "yesNo": "No"
        }
      },
      "alterationsAndChanges": {
        "hasStructuralAlterations": {
          "buildingRegApproval": {
            "yesNo": "Yes"
          },
          "planningPermission": {
            "yesNo": "Yes"
          },
          "listedBuildingConsent": {
            "yesNo": "Not required",
            "reasons": "Not listed building\n"
          },
          "deedRestrictionConsent": {
            "yesNo": "Not required",
            "reasons": "Retrospective consent obtained from leasehold provider but property now freehold"
          },
          "unfinished": {
            "yesNo": "No"
          },
          "yesNo": "Yes",
          "details": "Bedroom and ensuite shower room extension 2005"
        },
        "windowReplacementsSince2002": {
          "buildingRegApproval": {
            "yesNo": "Not required",
            "reasons": "Not required"
          },
          "planningPermission": {
            "yesNo": "Not required",
            "reasons": "Not required"
          },
          "listedBuildingConsent": {
            "yesNo": "Not required",
            "reasons": "Not listed building"
          },
          "deedRestrictionConsent": {
            "yesNo": "Not required",
            "reasons": "None required"
          },
          "unfinished": {
            "yesNo": "No"
          },
          "yesNo": "Yes",
          "details": "New front door added 2016"
        },
        "hasAddedConservatory": {
          "buildingRegApproval": {
            "yesNo": "Not required",
            "reasons": "Added as part of initial build"
          },
          "planningPermission": {
            "yesNo": "Not required",
            "reasons": "Added as part of initial build"
          },
          "listedBuildingConsent": {
            "yesNo": "Not required",
            "reasons": "Not listed building"
          },
          "deedRestrictionConsent": {
            "yesNo": "Not required",
            "reasons": "Added as part of initial build and deeds"
          },
          "unfinished": {
            "yesNo": "No"
          },
          "yesNo": "Yes",
          "details": "Conservatory added during house build in 1990 and exterior quality door separates the conservatory from the kitchen/dining room"
        },
        "planningPermissionBreaches": {
          "yesNo": "No"
        },
        "unresolvedPlanningIssues": {
          "yesNo": "No"
        }
      },
      "notices": {
        "neighbourDevelopment": {
          "yesNo": "No"
        },
        "planningApplication": {
          "yesNo": "No"
        },
        "requiredMaintenance": {
          "yesNo": "No"
        },
        "listedBuildingApplication": {
          "yesNo": "No"
        },
        "infrastructureProject": {
          "yesNo": "No"
        },
        "partyWallAct": {
          "yesNo": "No"
        },
        "otherNotices": {
          "yesNo": "No"
        }
      },
      "specialistIssues": {
        "dryRotEtcTreatment": {
          "yesNo": "No"
        },
        "containsAsbestos": {
          "yesNo": "No"
        },
        "japaneseKnotweed": {
          "yesNo": "No"
        },
        "subsidenceOrStructuralFault": {
          "yesNo": "No"
        },
        "ongoingHealthOrSafetyIssue": {
          "yesNo": "No"
        }
      },
      "fixturesAndFittings": {
        "itemsToRemove": {
          "yesNo": "No"
        },
        "itemsToInclude": {
          "yesNo": "No"
        }
      },
      "waterAndDrainage": {
        "mainsWater": {
          "maintenanceAgreements": {
            "yesNo": "No"
          },
          "yesNo": "Yes",
          "connected": "Yes",
          "supplier": "Northumbria Water"
        },
        "mainsSurfaceWaterDrainage": {
          "maintenanceAgreements": {
            "yesNo": "No"
          },
          "yesNo": "Yes",
          "connected": "Yes",
          "supplier": "Northumbria Water"
        },
        "mainsFoulDrainage": {
          "maintenanceAgreements": {
            "yesNo": "No"
          },
          "yesNo": "Yes",
          "connected": "Yes",
          "supplier": "Northumbria Water"
        }
      },
      "utilities": {
        "electricity": {
          "maintenanceAgreements": {
            "yesNo": "No"
          },
          "yesNo": "Yes",
          "connected": "Yes",
          "supplier": "Octopus Energy"
        },
        "gas": {
          "maintenanceAgreements": {
            "yesNo": "No"
          },
          "yesNo": "Yes",
          "connected": "Yes",
          "supplier": "Octopus Energy"
        },
        "lpg": {
          "yesNo": "No"
        },
        "oil": {
          "yesNo": "No"
        },
        "telephone": {
          "maintenanceAgreements": {
            "yesNo": "No"
          },
          "yesNo": "Yes",
          "connected": "Yes",
          "supplier": "EE"
        },
        "cableSatelliteTV": {
          "maintenanceAgreements": {
            "yesNo": "No"
          },
          "yesNo": "Yes",
          "connected": "Yes",
          "supplier": "Sky"
        },
        "broadband": {
          "maintenanceAgreements": {
            "yesNo": "No"
          },
          "yesNo": "Yes",
          "connected": "Yes",
          "supplier": "EE"
        },
        "solarPanels": {
          "yesNo": "No"
        },
        "otherServices": {
          "yesNo": "No"
        }
      },
      "greenDealLoan": {
        "hasGreenDealLoan": {
          "yesNo": "No"
        }
      },
      "centralHeating": {
        "hasCentralHeating": "Yes",
        "centralHeatingDetails": {
          "boilerInstallationCertificate": {
            "yesNo": "Yes",
            "details": "Certified installation"
          },
          "heatingInGoodWorkingOrder": {
            "yesNo": "Yes"
          },
          "centralHeatingFuel": "Gas boiler",
          "centralHeatingInstalled": "2016-04-20",
          "heatingLastServiced": "2021-03-26"
        }
      },
      "insurance": {
        "difficultiesObtainingInsurance": {
          "yesNo": "No"
        },
        "insuranceClaims": {
          "yesNo": "No"
        },
        "isInsured": "Yes"
      },
      "boundaries": {
        "partOutsideLegalOwnership": {
          "yesNo": "No"
        },
        "partOnSeparateSiteOrDeed": {
          "yesNo": "No"
        },
        "boundariesDifferFromTitlePlan": {
          "yesNo": "No"
        },
        "boundaryAlterationProposal": {
          "yesNo": "No"
        }
      },
      "rightsAndInformalArrangements": {
        "sharedContributions": {
          "yesNo": "No"
        },
        "neighbouringLandRights": {
          "yesNo": "No"
        },
        "accessRestrictionAttempts": {
          "yesNo": "No"
        },
        "rightsOrArrangements": {
          "publicRightOfWay": {
            "yesNo": "No"
          },
          "rightsofLightOrSupport": {
            "yesNo": "No"
          },
          "rightsCreatedThroughCustom": {
            "yesNo": "No"
          },
          "minesAndMinerals": {
            "yesNo": "No"
          },
          "churchChancel": {
            "yesNo": "No"
          },
          "otherRights": {
            "yesNo": "No"
          }
        }
      },
      "otherIssues": {
        "environmental": {
          "yesNo": "No"
        },
        "excessiveNoise": {
          "yesNo": "No"
        },
        "crime": {
          "yesNo": "No"
        },
        "cautionOrConviction": {
          "yesNo": "No"
        },
        "failedTransactionsInLast12Months": {
          "yesNo": "No"
        },
        "comments": "Not applicable"
      },
      "additionalInformation": {
        "restrictionsOnUseNotCompliedWith": {
          "yesNo": "No"
        },
        "otherMaterialIssue": {
          "yesNo": "No"
        }
      },
      "consumerProtectionRegulationsDeclaration": {
        "consumerProtectionRegulationsResponse": true
      }
    },
    "additionalLegalInfo": {
      "namesOfLegalOwners": [
        {